Name,DataType,MinCardinality,MaxCardinality,Description,MinLength,MaxLength,Enumeration,Pattern,MinInclusive,MinExclusive,MaxInclusive,MaxExclusive,DeprecatedNamespace,DeprecatedElementOrAttribute,DeprecatedChoiceGroup
VariableSchemeName,NameType,0,n,"A name for the VariableScheme. May be expressed in multiple languages. Repeat the element to express names with different content, for example different names for different systems.",,,,,,,,,ddi:logicalproduct:3_3,e,
Label,LabelType,0,n,"A display label for the VariableScheme. Supports multiple language versions of the same content as well as optional formatting of the content. Repeat for labels with different content, for example, labels with differing length limitations.",,,,,,,,,ddi:reusable:3_3,e,
Description,StructuredStringType,0,1,A description of the content and purpose of the VariableScheme. Supports multiple language versions of the same content as well as optional formatting of the content.,,,,,,,,,ddi:reusable:3_3,e,
VariableSchemeReference,VariableScheme,0,n,Allows for the inclusion of another VariableScheme by reference.,,,,,,,,,ddi:reusable:3_3,e,
VariableReference,Variable,0,n,Describes a Variable in-line. This is the applied expression of a data item within a data set.,,,,,,,,,ddi:logicalproduct:3_3,e,
VariableGroupReference,VariableGroup,0,n,"Contains a group of Variables, which may be ordered or hierarchical.",,,,,,,,,ddi:logicalproduct:3_3,e,
