Name,DataType,MinCardinality,MaxCardinality,Description,MinLength,MaxLength,Enumeration,Pattern,MinInclusive,MinExclusive,MaxInclusive,MaxExclusive,DeprecatedNamespace,DeprecatedElementOrAttribute,DeprecatedChoiceGroup
OrganizationIdentification,OrganizationIdentificationType,0,1,"Identification information on the Organization. The structure contains a OrganizationName which can be repeated to provide any number of OrganizationNames that have a) a specific contextual usage, or b) are of specific types (e.g. PreviousFormalName). The DDI Maintenance Agency ID and and organization images, such as a building picture or logo are found in OrganizationIdentification. Images and names can be individually date stamped.",,,,,,,,,ddi:archive:3_3,e,
Description,StructuredStringType,0,1,A description of the organization. Supports multiple language versions of the same content as well as optional formatting of the content.,,,,,,,,,ddi:reusable:3_3,e,
Keyword,InternationalCodeValueType,0,n,Keyword used to classify the organization or its activities. Supports the use of an external controlled vocabulary.,,,,,,,,,ddi:reusable:3_3,e,
RegionalCoverage,CodeValueType,0,n,The geographic region within which this organization operates.,,,,,,,,,ddi:archive:3_3,e,
AdditionalInformation,AdditionalInformationType,0,n,Any additional information you which to note about the organization. This is a structured string so it can be formatted and a privacy tag can be applied.,,,,,,,,,ddi:archive:3_3,e,
VersionDistinction,VersionDistinctionType,0,n,"Describes the data versioning scheme(s) used by an organization. If more than one, Name should differentiate between a standard versioning structure used by the organization and special structures used by specific projects or studies. Information on what drives and major and minor change and how they are structured.",,,,,,,,,ddi:archive:3_3,e,
ContactInformation,ContactInformationType,0,n,"Contact information for the organization including location specification, address, URL, phone numbers, and other means of communication access. Address, location, telephone, and other means of communication can be repeated to express multiple means of a single type or change over time. Each major piece of contact information (with exception of URL contains the element EffectiveDates in order to date stamp the period for which the information is valid.",,,,,,,,,ddi:archive:3_3,e,
Privacy,string,0,1,A basic set of privacy codes for the parent element. These may be stricter than the general access restrictions for the overall metadata. If available codes are insufficient this may also contain any string.,,,public restricted private,,,,,,,a,
