Name,DataType,MinCardinality,MaxCardinality,Description,Ordered,AllowSubtypes,MinLength,MaxLength,Enumeration,Pattern,MinInclusive,MinExclusive,MaxInclusive,MaxExclusive,DeprecatedNamespace,DeprecatedElementOrAttribute,DeprecatedChoiceGroup
DevelopmentActivityName,NameType,0,n,"A name for the Development Activity. May be expressed in multiple languages. Repeat the element to express names with different content, for example different names for different systems.",,,,,,,,,,,ddi:datacollection:3_3,e,
Label,LabelType,0,n,"A display label for the Development Activity. Supports multiple language versions of the same content as well as optional formatting of the content. Repeat for labels with different content, for example, labels with differing length limitations.",,,,,,,,,,,ddi:reusable:3_3,e,
Description,StructuredStringType,0,1,A description of the content and purpose of the Development Activity. Supports multiple language versions of the same content as well as optional formatting of the content.,,,,,,,,,,,ddi:reusable:3_3,e,
DesiredOutcome,StructuredStringType,0,1,"Describe the desired outcomes of the development activity. Address why the activity should take place, means of determining successful completion, etc.",,,,,,,,,,,ddi:datacollection:3_3,e,
ProcessSummary,StructuredStringType,0,1,Summarize the process the activity should follow to meet desired outcomes.,,,,,,,,,,,ddi:datacollection:3_3,e,
RecommendedStaffRequirements,RecommendedStaffRequirementsType,0,n,Specify requirements for type of staffing needed to complete activity. Repeat for each staff class,,,,,,,,,,,ddi:datacollection:3_3,e,
AdditionalRequiredResources,StructuredStringType,0,1,"Describe additional resources required such as funding, staffing, or resource material.",,,,,,,,,,,ddi:datacollection:3_3,e,
DebriefingProcess,DebriefingProcessType,0,1,"Describe the debriefing process. This is especially important for assessing the quality of focus groups, cognitive interviews, etc. Specifies if debriefing is required.",,,,,,,,,,,ddi:datacollection:3_3,e,
