Name,DataType,MinCardinality,MaxCardinality,Description,MinLength,MaxLength,Enumeration,Pattern,MinInclusive,MinExclusive,MaxInclusive,MaxExclusive,DeprecatedNamespace,DeprecatedElementOrAttribute,DeprecatedChoiceGroup
PhysicalStructureSchemeName,NameType,0,n,"A name for the PhysicalStructureScheme. May be expressed in multiple languages. Repeat the element to express names with different content, for example different names for different systems.",,,,,,,,,ddi:physicaldataproduct:3_2,e,
Label,LabelType,0,n,"A display label for the PhysicalStructureScheme. May be expressed in multiple languages. Repeat for labels with different content, for example, labels with differing length limitations.",,,,,,,,,ddi:reusable:3_2,e,
Description,StructuredStringType,0,1,A description of the PhysicalStructureScheme. May be expressed in multiple languages and supports the use of structured content.,,,,,,,,,ddi:reusable:3_2,e,
PhysicalStructureSchemeReference,PhysicalStructureScheme,0,n,Reference to an existing PhysicalStructureScheme for inclusion.,,,,,,,,,ddi:reusable:3_2,e,
PhysicalStructureReference,PhysicalStructure,0,n,A PhysicalStructure description providing the primary link to the LogicalRecord and general structural information. Each description can apply to one or more data files containing the same logical records in the same overall structure.,,,,,,,,,ddi:physicaldataproduct:3_2,e,
PhysicalStructureGroupReference,PhysicalStructureGroup,0,n,A group of PhysicalStructure descriptions for administrative or conceptual purposes.,,,,,,,,,ddi:physicaldataproduct:3_2,e,
