Name,DataType,MinCardinality,MaxCardinality,Description,Ordered,AllowSubtypes,MinLength,MaxLength,Enumeration,Pattern,MinInclusive,MinExclusive,MaxInclusive,MaxExclusive,DeprecatedNamespace,DeprecatedElementOrAttribute,DeprecatedChoiceGroup
MeasurementSchemeName,langString,0,n,"A name for the MeasurementScheme.",,,,,,,,,,,ddi:datacollection:3_3,e,
Label,langString,0,n,"A display label for the scheme.",,,,,,,,,,,ddi:reusable:3_3,e,
Description,langString,0,n,A description of the content and purpose of the MeasurementItemScheme.,,,,,,,,,,,ddi:reusable:3_3,e,
MeasurementSchemeReference,MeasurementScheme,0,n,Allows for the inclusion of another MeasurementItemScheme by reference.,,,,,,,,,,,ddi:reusable:3_3,e,
MeasurementItemReference,MeasurementItem,0,n,Describes a MeasurementItem in-line.,,,,,,,,,,,ddi:datacollection:3_3,e,
MeasurementGroupReference,MeasurementGroup,0,n,"Contains a group of MeasurementItems, which may be ordered or hierarchical.",,,,,,,,,,,ddi:datacollection:3_3,e,
