Name,DataType,MinCardinality,MaxCardinality,Description,Ordered,AllowSubtypes,MinLength,MaxLength,Enumeration,Pattern,MinInclusive,MinExclusive,MaxInclusive,MaxExclusive,DeprecatedNamespace,DeprecatedElementOrAttribute,DeprecatedChoiceGroup
QuestionSchemeName,langString,0,n,"A name for the QuestionScheme.",,,,,,,,,,,ddi:datacollection:3_3,e,
Label,langString,0,n,"A display label for the QuestionScheme.",,,,,,,,,,,ddi:reusable:3_3,e,
Description,langString,0,n,A description of the content and purpose of the QuestionScheme.,,,,,,,,,,,ddi:reusable:3_3,e,
QuestionSchemeReference,QuestionScheme,0,n,Allows for the inclusion of another QuestionScheme by reference.,,,,,,,,,,,ddi:reusable:3_3,e,
QuestionItemReference,QuestionItem,0,n,Describes a QuestionItem in-line.,,,,,,,,,,,ddi:datacollection:3_3,e,
QuestionGridReference,QuestionGrid,0,n,Describes a QuestionGrid in-line.,,,,,,,,,,,ddi:datacollection:3_3,e,
QuestionBlockReference,QuestionBlock,0,n,Describes a QuestionBlock in-line.,,,,,,,,,,,ddi:datacollection:3_3,e,
QuestionGroupReference,QuestionGroup,0,n,"Contains a group of Questions, which may be ordered or hierarchical.",,,,,,,,,,,ddi:datacollection:3_3,e,
