Name,DataType,MinCardinality,MaxCardinality,Description,Ordered,AllowSubtypes,MinLength,MaxLength,Enumeration,Pattern,MinInclusive,MinExclusive,MaxInclusive,MaxExclusive,DeprecatedNamespace,DeprecatedElementOrAttribute,DeprecatedChoiceGroup
SeriesContext,CodeValueType,0,1,A Classification Series can be designed in a specific context.,,,,,,,,,,,ddi:logicalproduct:3_3,e,
UnitTypeClassified,UnitType,0,1,A Classification Series is designed to classify a specific type of object/unit according to a specific attribute.,,,,,,,,,,,ddi:logicalproduct:3_3,e,
SubjectArea,CodeValueType,0,n,Areas of statistics in which the Classification Series is implemented.,,,,,,,,,,,ddi:logicalproduct:3_3,e,
Owner,Agent,0,n,"The statistical office or other authority, which created and maintains the Statistical Classification(s) related to the Classification Series. A Classification Series may have several owners.",,,,,,,,,,,ddi:logicalproduct:3_3,e,
Keyword,InternationalCodeValueType,0,n,A Classification Series can be associated with one or a number of keywords.,,,,,,,,,,,ddi:reusable:3_3,e,
StatisticalClassificationReference,StatisticalClassification,0,n,A Classification Series has at least one Statistical Classification.,,,,,,,,,,,ddi:reusable:3_3,e,
CurrentStatisticalClassification,StatisticalClassification,0,1,"If there are several Statistical Classifications related to a Classification Series, one Statistical Classification may be assigned as the currently valid Statistical Classification.",,,,,,,,,,,ddi:logicalproduct:3_3,e,
