Name,DataType,MinCardinality,MaxCardinality,Description,Ordered,AllowSubtypes,MinLength,MaxLength,Enumeration,Pattern,MinInclusive,MinExclusive,MaxInclusive,MaxExclusive,DeprecatedNamespace,DeprecatedElementOrAttribute,DeprecatedChoiceGroup
Description,langString,0,n,A description of the development objects that are the intended objects of a Development Plan or specific objects of a Development Step.,,,,,,,,,,,ddi:reusable:3_3,e,
QuestionReference,Question,0,n,"Reference to the Question type that is the target of the development work. TypeOfObject should be QuestionItem, QuestionGrid, or QuestionBlock.",,true,,,,,,,,,ddi:reusable:3_3,e,
MeasurementReference,MeasurementItem,0,n,Reference to the Measurement that is the target of the development work. TypeOfObject should be Measurement.,,,,,,,,,,,ddi:reusable:3_3,e,
InstrumentReference,Instrument,0,n,Reference to the Instrument that is the target of the development work. TypeOfObject should be Instrument.,,,,,,,,,,,ddi:datacollection:3_3,e,
ControlConstructReference,ControlConstruct,0,n,"Reference to the ControlConstruct that is the target of the development work. TypeOfObject should reflect the type of ControlConstruct being referenced. Value should be IfThenElse, RepeatUntil, RepeatWhile, Loop, Sequence, ComputationItem, StatementItem, MeasurementConstruct, QuestionConstruct, Split, SplitJoin, SamplingStage, SampleStep, DevelopmentStep.",,true,,,,,,,,,ddi:datacollection:3_3,e,
