Name,DataType,MinCardinality,MaxCardinality,Description,Ordered,AllowSubtypes,MinLength,MaxLength,Enumeration,Pattern,MinInclusive,MinExclusive,MaxInclusive,MaxExclusive,DeprecatedNamespace,DeprecatedElementOrAttribute,DeprecatedChoiceGroup
SourceObject,SourceObjectType,0,1,Identifies the Source organization or individual in the relationship. Source to Target provides a directional perception when defining the relationship.,,,,,,,,,,,ddi:archive:3_3,e,
TargetObject,TargetObjectType,0,1,Identifies the Target organization or individual in the relationship. The Target object describes its role in relationship to the Source object.,,,,,,,,,,,ddi:archive:3_3,e,
Description,StructuredStringType,0,1,A description of the relationship. Supports multiple language versions of the same content as well as optional formatting of the content.,,,,,,,,,,,ddi:reusable:3_3,e,
Keyword,InternationalCodeValueType,0,n,A brief textual identification of the relation type. Supports the use of an external controlled vocabulary.,,,,,,,,,,,ddi:reusable:3_3,e,
EffectivePeriod,DateType,0,n,Time period during which this relationship is valid.,,,,,,,,,,,ddi:reusable:3_3,e,
AdditionalInformation,AdditionalInformationType,0,n,Any information not captured by the other descriptive objects. The privacy code may be set to indicate access restriction to this information. Supports multiple language versions of the same content as well as optional formatting of the content.,,,,,,,,,,,ddi:archive:3_3,e,
Privacy,string,0,1,A basic set of privacy codes for the parent element. These may be stricter than the general access restrictions for the overall metadata. If available codes are insufficient this may also contain any string.,,,,,public restricted private,,,,,,,a,
