Name,DataType,MinCardinality,MaxCardinality,Description,Ordered,AllowSubtypes,MinLength,MaxLength,Enumeration,Pattern,MinInclusive,MinExclusive,MaxInclusive,MaxExclusive,DeprecatedNamespace,DeprecatedElementOrAttribute,DeprecatedChoiceGroup
RecommendedDataType,CodeValueType,0,1,"This field provides the recommended treatment of the data within an application. The value should come from a controlled vocabulary - recommended values include the set found in W3C XML Schema Part 2, but excluding string sub-types, QNAME, and NOTATION. The DDI Alliance has provided a controlled vocabulary (DataType) to support this element at http://www.ddialliance.org/controlled-vocabularies.",,,,,,,,,,,ddi:reusable:3_3,e,
GenericOutputFormat,CodeValueType,0,1,This field provides a recommended generic treatment of the data for display by an application. The value should come from a controlled vocabulary.,,,,,,,,,,,ddi:reusable:3_3,e,
MeasurementUnit,CodeValueType,0,1,"Records the measurement unit, for example, 'km', 'miles', etc. Supports the use of a controlled vocabulary.",,,,,,,,,,,ddi:reusable:3_3,e,
ExternalCategoryReference,anyURI,0,1,"References an external, non DDI category. This is the element to use if the Code Scheme being used is not in DDI and cannot be used directly. It provides for both the reference and an explanation of how to use the information accurately within a DDI context.",,,,,,,,,,,ddi:reusable:3_3,e,
UsageDescription,StructuredStringType,0,1,A description of the use of the external category file. Supports multiple language versions of the same content as well as optional formatting of the content.,,,,,,,,,,,ddi:reusable:3_3,e,
ClassificationLevel,string,0,1,"Indicates the type of relationship, nominal, ordinal, interval, ratio, or continuous. Use where appropriate for the representation type.",,,,,Nominal Ordinal Interval Ratio Continuous,,,,,,,a,
